{
 "projectKey": "WAR",
 "defaultIssueType": "Story",
 "defaultLabels": [
  "warp-demo",
  "run:edit"
 ],
 "source": {
  "prdTitle": "WarpEdit spec (WARPDEMO/WarpEdit/spec/SPEC.md)",
  "prdVersion": "2",
  "generatedAt": "2026-10-13"
 },
 "tickets": [
  {
   "tempId": "WE-01",
   "summary": "Editor scaffold on WarpView's modules, and the read-only audit",
   "issueType": "Story",
   "priority": "High",
   "labels": [
    "size:S",
    "gate:G0",
    "lane:platform",
    "run:edit",
    "warp-demo"
   ],
   "layer": "ui",
   "systems": [
    {
     "system": "WarpEdit",
     "component": "platform"
    }
   ],
   "areasProposed": [
    "platform"
   ],
   "forgeRepo": "smlsr/WarpDemo",
   "forgeMode": null,
   "parentTempId": null,
   "blockedByTempIds": [
    "view:WV-15"
   ],
   "why": "WarpEdit is the WarpView screens plus one change: reset a ticket's phase. Building it as a second copy of\n    the viewer would fork the model and the screens on day one. It must import WarpView's modules, add its controls\n    only through WarpView's hooks, and prove before any edit work starts that the viewer itself cannot change a\n    phase, so the two products stay separate.",
   "what": "1. `WARPDEMO/WarpEdit/app/package.json` with scripts `test` (`node --test`), `build` (`WARPDEMO/WarpEdit/app/dist/editor.html`) and\n    `release` (`WARPDEMO/WarpEdit/editor.html`); devDependencies pinned like WarpView (esbuild 0.24.0, jsdom 25.0.1). 2.\n    `WARPDEMO/WarpEdit/app/build.mjs`: entry `src/main.mjs`, CSS from `WARPDEMO/WarpView/app/src/**/*.css` (styles first) then `WARPDEMO/WarpEdit/app/src/**/*.css`,\n    shell from `WARPDEMO/WarpView/app/src/shell.html` with the title 'Warp Editor' and the badge 'Editing'. 3. `src/main.mjs`:\n    `createApp({root, plugins})` imported from `WARPDEMO/WarpView/app/src/main.mjs` with the plugins listed in `src/plugins.mjs`\n    (append-only: each later ticket adds one import and one array entry). 4. `WARPDEMO/WarpEdit/app/test/audit.test.mjs`: the audit of\n    SPEC §2 over `WARPDEMO/WarpView/app/src/`: no assignment to a ticket's status outside load/parse, no data-edit attribute, no\n    'Reset' label; it lists the thirteen phases of SPEC §3.",
   "outOfScope": [],
   "acceptanceCriteria": [
    {
     "id": "AC-1",
     "kind": "happy",
     "text": "Given WarpView merged through WV-15, when `npm --prefix WARPDEMO/WarpEdit/app ci && npm --prefix WARPDEMO/WarpEdit/app run build` runs, then `WARPDEMO/WarpEdit/app/dist/editor.html` opens with the WarpView empty state, the title 'Warp Editor' and the 'Editing' badge."
    },
    {
     "id": "AC-2",
     "kind": "happy",
     "text": "Given the audit, when run over WarpView's src, then it passes and prints the thirteen phases."
    },
    {
     "id": "AC-3",
     "kind": "negative",
     "text": "Given a test copy of WarpView's drawer that sets ticket.status, when the audit runs on that copy, then it fails naming the file and line."
    },
    {
     "id": "AC-4",
     "kind": "edge",
     "text": "Given plugins.mjs with an empty plugin list, when the editor builds, then it behaves exactly like the viewer (no edit control) — the plugins carry every edit feature."
    },
    {
     "id": "AC-5",
     "kind": "happy",
     "text": "Given `npm --prefix WARPDEMO/WarpEdit/app test`, when run, then audit.test.mjs and the build test pass."
    }
   ],
   "nfrs": [
    {
     "id": "NFR-1",
     "text": "No network calls: the built file loads nothing from outside itself."
    }
   ],
   "technicalDetails": {
    "services": [
     "WARPDEMO/WarpEdit/app/package.json",
     "WARPDEMO/WarpEdit/app/build.mjs",
     "WARPDEMO/WarpEdit/app/.gitignore",
     "WARPDEMO/WarpEdit/app/src/main.mjs",
     "WARPDEMO/WarpEdit/app/src/plugins.mjs",
     "WARPDEMO/WarpEdit/app/test/"
    ],
    "apiContract": "none (static page; module exports listed in SPEC §11)",
    "dataMigration": "none",
    "idempotency": "Rendering is a pure function of the loaded files and the view state; loading the same files twice gives the same screen.",
    "configKeys": [],
    "vendors": [],
    "implementerNotes": "Repo layout: `WARPDEMO/WarpEdit/spec|plan|tickets|fixtures|ui` is the read-only pack; write code only under the lock folders above (inside `WARPDEMO/WarpEdit/app/`). Start with `Implement WE-01`. Run `npm --prefix WARPDEMO/WarpEdit/app ci` once, then `npm --prefix WARPDEMO/WarpEdit/app test`. Read-only for this run: everything under `WARPDEMO/WarpView/`. Import from it; never edit it."
   },
   "featureFlag": null,
   "releaseNotes": {
    "title": "Editor scaffold on WarpView's modules, and the read-only audit",
    "description": "Editor scaffold on WarpView's modules, and the read-only audit",
    "impacts": [],
    "audience": "internal",
    "visibility": "silent"
   },
   "userInterface": null,
   "logging": {
    "events": [
     {
      "name": "load.failed",
      "level": "error",
      "when": "a file cannot be read or parsed",
      "fields": [
       "path",
       "reason"
      ]
     }
    ],
    "requiredFieldsEveryLine": [
     "path"
    ],
    "neverLog": [
     "file contents",
     "tokens or keys found in config"
    ],
    "retention": "browser console only"
   },
   "metrics": {
    "metrics": [],
    "dashboard": "none",
    "alerts": [],
    "sloTouched": "none"
   },
   "analyticsEvents": [],
   "environment": {
    "name": "local browser + node 22",
    "testData": "WARPDEMO/WarpEdit/fixtures/beam.sample.json"
   },
   "dependenciesRisks": {
    "dependsOn": [
     "view:WV-15"
    ],
    "vendorsInTest": [],
    "risks": "Low: one module folder, covered by its own tests.",
    "rollback": "Revert the PR; the module folder is self-contained."
   },
   "notes": "Run `edit` · gate G0 · lane platform. Product code under `WARPDEMO/WarpEdit/app/`; the pack folders are read-only.",
   "links": [
    {
     "title": "Agent rules (preamble)",
     "url": "WARPDEMO/AGENTS.md"
    },
    {
     "title": "SPEC",
     "url": "WARPDEMO/WarpEdit/spec/SPEC.md"
    },
    {
     "title": "Acceptance queries",
     "url": "WARPDEMO/WarpEdit/spec/ACCEPTANCE.md"
    },
    {
     "title": "Runbook",
     "url": "WARPDEMO/WarpEdit/plan/BUILD_PLAN.md"
    },
    {
     "title": "Plan and waves",
     "url": "WARPDEMO/WarpEdit/plan/CURSOR_PLAN.md"
    },
    {
     "title": "WarpView SPEC (model, screens, hooks)",
     "url": "WARPDEMO/WarpView/spec/SPEC.md"
    },
    {
     "title": "WarpView design of record",
     "url": "WARPDEMO/WarpView/ui/reference/warp-dashboard.html"
    }
   ]
  },
  {
   "tempId": "WE-02",
   "summary": "Edit store: change log, undo and redo, unsaved count",
   "issueType": "Story",
   "priority": "High",
   "labels": [
    "size:M",
    "gate:G1",
    "lane:model",
    "run:edit",
    "warp-demo"
   ],
   "layer": "ui",
   "systems": [
    {
     "system": "WarpEdit",
     "component": "model"
    }
   ],
   "areasProposed": [
    "model"
   ],
   "forgeRepo": "smlsr/WarpDemo",
   "forgeMode": null,
   "parentTempId": null,
   "blockedByTempIds": [
    "WE-01"
   ],
   "why": "Every reset must be reversible until the file is saved, and the editor must always know what changed\n    since load. Without a change log, undo would have to guess the old status, dependents' statuses would be lost,\n    and save could not say how many changes it is writing. The store is the one place edits happen; screens only\n    read it.",
   "what": "Create `WARPDEMO/WarpEdit/app/src/edit/store/store.mjs` per SPEC §4. 1. `createEditStore(beam)` keeps the loaded document\n    untouched and a working copy. 2. `apply(change)` where a change is `{ticket, from, to, at, note, by,\n    dependents:[{id, from, to}]}`; returns the new working copy. 3. `undo()` and `redo()` with a 50-step history;\n    a new change after an undo clears the redo stack. 4. `dirty` count = changes applied and not undone since load\n    or the last save; `markSaved()`. 5. `subscribe(fn)` called with `{reason, change}`. 6. Never mutate the\n    loaded document or a previous working copy (copy-on-write, tested with Object.freeze).",
   "outOfScope": [],
   "acceptanceCriteria": [
    {
     "id": "AC-1",
     "kind": "happy",
     "text": "Given `WARPDEMO/WarpEdit/fixtures/beam.sample.json`, when a change WV-07 merged→coding is applied, then working.tickets['WV-07'].status is coding, dirty is 1 and the loaded beam still says merged."
    },
    {
     "id": "AC-2",
     "kind": "happy",
     "text": "Given two changes then undo, when redo runs, then the state equals the state after two changes and dirty is 2."
    },
    {
     "id": "AC-3",
     "kind": "edge",
     "text": "Given 55 changes, when undo runs 60 times, then only 50 are undone and the 51st-oldest change remains."
    },
    {
     "id": "AC-4",
     "kind": "negative",
     "text": "Given a frozen loaded beam, when apply runs, then nothing throws (no mutation of frozen objects)."
    },
    {
     "id": "AC-5",
     "kind": "happy",
     "text": "Given `npm --prefix WARPDEMO/WarpEdit/app test`, when run, then store.test.mjs passes."
    }
   ],
   "nfrs": [
    {
     "id": "NFR-1",
     "text": "No network calls: the built file loads nothing from outside itself."
    }
   ],
   "technicalDetails": {
    "services": [
     "WARPDEMO/WarpEdit/app/src/edit/store/"
    ],
    "apiContract": "none (static page; module exports listed in SPEC §11)",
    "dataMigration": "none",
    "idempotency": "Rendering is a pure function of the loaded files and the view state; loading the same files twice gives the same screen.",
    "configKeys": [],
    "vendors": [],
    "implementerNotes": "Repo layout: `WARPDEMO/WarpEdit/spec|plan|tickets|fixtures|ui` is the read-only pack; write code only under the lock folders above (inside `WARPDEMO/WarpEdit/app/`). Start with `Implement WE-02`. Run `npm --prefix WARPDEMO/WarpEdit/app ci` once, then `npm --prefix WARPDEMO/WarpEdit/app test`."
   },
   "featureFlag": null,
   "releaseNotes": {